{
  "$schema": "https://json-schema.org/draft/2020-12/schema",
  "$id": "https://starlight-unit.de/schemas/quantum-runtime/model-manifest-v1alpha1.schema.json",
  "title": "Quantum Runtime Model Manifest v1alpha1",
  "type": "object",
  "additionalProperties": false,
  "required": [
    "schema_version",
    "id",
    "display_name",
    "source",
    "backend",
    "artifacts",
    "model",
    "capabilities",
    "compatibility",
    "state",
    "provenance"
  ],
  "properties": {
    "schema_version": {
      "const": "quantum.runtime/model-manifest/v1alpha1"
    },
    "id": {
      "type": "string",
      "pattern": "^[a-z0-9][a-z0-9._-]{0,127}$"
    },
    "display_name": {
      "type": "string",
      "minLength": 1,
      "maxLength": 160
    },
    "aliases": {
      "type": "array",
      "uniqueItems": true,
      "items": {
        "type": "string",
        "pattern": "^[A-Za-z0-9][A-Za-z0-9._:/-]{0,159}$"
      }
    },
    "source": {
      "type": "object",
      "additionalProperties": false,
      "required": ["provider", "reference", "revision"],
      "properties": {
        "provider": {"type": "string", "pattern": "^[A-Za-z0-9][A-Za-z0-9._+-]{0,79}$"},
        "reference": {"type": "string", "minLength": 1, "maxLength": 300},
        "revision": {"type": "string", "minLength": 1, "maxLength": 200}
      }
    },
    "backend": {
      "type": "object",
      "additionalProperties": false,
      "required": ["type"],
      "properties": {
        "type": {
          "enum": ["ollama-adapter", "gguf", "safetensors", "external"]
        }
      }
    },
    "artifacts": {
      "type": "array",
      "minItems": 1,
      "items": {
        "type": "object",
        "additionalProperties": false,
        "required": ["uri"],
        "properties": {
          "uri": {"type": "string", "minLength": 3},
          "sha256": {"type": "string", "pattern": "^sha256:[a-f0-9]{64}$"}
        }
      }
    },
    "model": {
      "type": "object",
      "additionalProperties": false,
      "required": ["architecture", "parameter_class", "quantization", "context_window"],
      "properties": {
        "architecture": {"type": "string", "pattern": "^[A-Za-z0-9][A-Za-z0-9._+-]{0,79}$"},
        "parameter_class": {"type": "string", "pattern": "^[A-Za-z0-9][A-Za-z0-9._+-]{0,79}$"},
        "quantization": {"type": "string", "pattern": "^[A-Za-z0-9][A-Za-z0-9._+-]{0,79}$"},
        "context_window": {"type": "integer", "minimum": 1, "maximum": 10000000}
      }
    },
    "capabilities": {
      "type": "object",
      "additionalProperties": false,
      "required": ["text", "vision", "audio", "embeddings", "tools", "thinking"],
      "properties": {
        "text": {"type": "boolean"},
        "vision": {"type": "boolean"},
        "audio": {"type": "boolean"},
        "embeddings": {"type": "boolean"},
        "tools": {"type": "boolean"},
        "thinking": {"type": "boolean"}
      },
      "anyOf": [
        {"properties": {"text": {"const": true}}},
        {"properties": {"vision": {"const": true}}},
        {"properties": {"audio": {"const": true}}},
        {"properties": {"embeddings": {"const": true}}},
        {"properties": {"tools": {"const": true}}},
        {"properties": {"thinking": {"const": true}}}
      ]
    },
    "compatibility": {
      "type": "object",
      "additionalProperties": false,
      "required": ["min_runtime_version"],
      "properties": {
        "min_runtime_version": {"type": "string", "pattern": "^[0-9]+\\.[0-9]+\\.[0-9]+(?:-[0-9A-Za-z.-]+)?$"},
        "max_runtime_version": {"type": "string", "pattern": "^[0-9]+\\.[0-9]+\\.[0-9]+(?:-[0-9A-Za-z.-]+)?$"}
      }
    },
    "persona": {
      "type": "object",
      "additionalProperties": false,
      "required": ["package", "version"],
      "properties": {
        "package": {"type": "string", "pattern": "^[a-z0-9][a-z0-9._-]{0,127}$"},
        "version": {"type": "string", "pattern": "^[0-9]+\\.[0-9]+\\.[0-9]+(?:-[0-9A-Za-z.-]+)?$"},
        "sha256": {"type": "string", "pattern": "^sha256:[a-f0-9]{64}$"}
      }
    },
    "state": {
      "type": "object",
      "additionalProperties": false,
      "required": ["install", "verification", "lifecycle"],
      "properties": {
        "install": {"enum": ["external", "available", "installed"]},
        "verification": {"enum": ["unverified", "verified", "failed"]},
        "lifecycle": {"enum": ["active", "deprecated", "blocked"]}
      },
      "not": {
        "properties": {
          "verification": {"const": "failed"},
          "lifecycle": {"const": "active"}
        },
        "required": ["verification", "lifecycle"]
      }
    },
    "provenance": {
      "type": "object",
      "additionalProperties": false,
      "required": ["publisher"],
      "properties": {
        "publisher": {"type": "string", "minLength": 1, "maxLength": 200},
        "source_url": {"type": "string", "format": "uri"},
        "license_ref": {"type": "string", "maxLength": 160},
        "retrieved_at": {"type": "string", "format": "date-time"}
      }
    }
  },
  "allOf": [
    {
      "if": {
        "properties": {
          "state": {
            "properties": {"verification": {"const": "verified"}},
            "required": ["verification"]
          }
        }
      },
      "then": {
        "properties": {
          "artifacts": {
            "items": {"required": ["uri", "sha256"]}
          },
          "source": {
            "properties": {
              "revision": {"not": {"const": "unresolved"}}
            }
          }
        }
      }
    }
  ]
}
